{
  "$schema": "https://json-schema.org/draft/2020-12/schema",
  "additionalProperties": true,
  "description": "Minimal AIDE protocol envelope for the accepted lifecycle fixture runner slice.",
  "properties": {
    "apiVersion": {
      "type": "string"
    },
    "kind": {
      "type": "string"
    },
    "metadata": {
      "additionalProperties": true,
      "properties": {
        "compatibility": {
          "additionalProperties": true,
          "properties": {
            "featureFlags": {
              "items": {
                "type": "string"
              },
              "type": "array"
            },
            "minReaderVersion": {
              "type": "string"
            },
            "minWriterVersion": {
              "type": "string"
            },
            "protocolVersion": {
              "type": "string"
            },
            "requiredCapabilities": {
              "items": {
                "type": "string"
              },
              "type": "array"
            },
            "schemaVersion": {
              "type": "string"
            }
          },
          "type": "object"
        },
        "createdAt": {
          "type": "string"
        },
        "id": {
          "type": "string"
        },
        "producer": {
          "additionalProperties": true,
          "properties": {
            "name": {
              "type": "string"
            },
            "version": {
              "type": "string"
            }
          },
          "type": "object"
        },
        "sourcePath": {
          "type": "string"
        }
      },
      "type": "object"
    },
    "protocol_version": {
      "type": "string"
    },
    "schema_version": {
      "type": "string"
    },
    "spec": {
      "additionalProperties": true,
      "type": "object"
    },
    "status": {
      "additionalProperties": true,
      "type": "object"
    }
  },
  "required": [
    "apiVersion",
    "kind",
    "metadata",
    "spec",
    "status"
  ],
  "title": "AIDE Minimal Protocol Envelope",
  "type": "object"
}
