{
  "apiVersion": "aide.dev/v1alpha1",
  "kind": "WorkUnit",
  "metadata": {
    "compatibility": {
      "featureFlags": [
        "minimal_workunit_queue_v1"
      ],
      "minReaderVersion": "0.1.0",
      "minWriterVersion": "0.1.0",
      "protocolVersion": "0.1.0",
      "requiredCapabilities": [
        "minimal_workunit_queue_v1"
      ],
      "schemaVersion": "0.1.0"
    },
    "createdAt": "deterministic",
    "id": "wu-17cdf4235004ffcf",
    "name": "Build AIDE Self-Validation Process Adapter",
    "producer": {
      "name": "aide-lite",
      "version": "0.1.0"
    },
    "sourcePath": ".aide/queue/AIDE-BUILD-AIDE-SELF-VALIDATION-PROCESS-ADAPTER-01/task.yaml"
  },
  "protocol_version": "0.1.0",
  "schema_version": "aide.workunit-queue.v1",
  "spec": {
    "acceptance_review": false,
    "artifacts": [
      {
        "path": ".aide/reports/aide-self-validation-process-adapter/context-descriptor.json",
        "role": "context_descriptor",
        "sha256": "sha256:0086383a0a9818cfd49df8c3f8d89d1ba26df17696a1b7cea97ed6cacc88c416"
      },
      {
        "path": ".aide/reports/aide-self-validation-process-adapter/context-pack.json",
        "role": "context_pack",
        "sha256": "sha256:9c1967bd54964443196b2f0767118f25fe0411a8e89e5e473557af1c17cf4503"
      },
      {
        "path": ".aide/reports/aide-self-validation-process-adapter/invocation-result.json",
        "role": "invocation_result",
        "sha256": "sha256:752a931a6a54d25ac1d174b1f4eaf2cecca77429f2c268044caa65fa9fccadb8"
      }
    ],
    "authorized_invocation_count": 1,
    "authorizes_implementation": true,
    "capability_label": "minimal_workunit_queue_v1",
    "check_only": false,
    "dependencies": [],
    "evidence_requirements": [
      ".aide/reports/aide-self-validation-process-adapter/invocation-result.json",
      ".aide/reports/aide-self-validation-process-adapter/execution-receipt.json",
      ".aide/reports/aide-self-validation-process-adapter/capability-outcome.json",
      ".aide/reports/aide-self-validation-process-adapter/evidence-packet.json",
      ".aide/reports/aide-self-validation-process-adapter/event-record.json"
    ],
    "explicit_non_capabilities": [
      "registered_process_provider_acceptance",
      "arbitrary_command_runner",
      "generic_command_cli",
      "provider_core_mutation",
      "dominium_adapter_mutation",
      "eureka_adapter",
      "service_runtime",
      "worker_execution",
      "provider_model_call",
      "network_call",
      "workbench_behavior",
      "preview_or_apply",
      "rollback",
      "patch_transaction_apply",
      "source_repository_mutation",
      "target_repository_mutation",
      "branch_worktree_automation",
      "github_mutation",
      "release_or_promotion"
    ],
    "implementation_scope": "thin-aide-self-validation-adapter-over-registered-process-provider-v0",
    "predecessors": [
      "AIDE-CHECK-REGISTERED-PROCESS-EXECUTION-PROVIDER-V0-REPAIR-01"
    ],
    "proposed_capability_label": "aide_self_validation_process_adapter_v0",
    "provider_ref": "registered_process_execution_provider_v0",
    "registered_capability_id": "aide.self.validate",
    "registered_capability_ref": "aide://capability/aide-self-validation-process-adapter-v0",
    "scope": {
      "allowed_paths": [
        "core/interop/aide/**",
        ".aide/scripts/aide_lite.py",
        ".aide/scripts/tests/test_aide_self_validation_process_adapter.py",
        ".aide/reports/aide-self-validation-process-adapter/**",
        ".aide/queue/AIDE-BUILD-AIDE-SELF-VALIDATION-PROCESS-ADAPTER-01/**",
        ".aide/queue/index.yaml",
        "PLANS.md",
        "IMPLEMENT.md"
      ],
      "forbidden_operations": [
        "registered_process_provider_acceptance",
        "arbitrary_command_runner",
        "generic_command_cli",
        "provider_core_mutation",
        "dominium_adapter_mutation",
        "eureka_adapter",
        "service_runtime",
        "worker_execution",
        "provider_model_call",
        "network_call",
        "workbench_behavior",
        "preview_or_apply",
        "rollback",
        "patch_transaction_apply",
        "source_repository_mutation",
        "target_repository_mutation",
        "branch_worktree_automation",
        "github_mutation",
        "release_or_promotion"
      ],
      "forbidden_paths": [
        "core/execution/registered_process.py",
        "core/protocol/process_invocation.py",
        "core/protocol/execution_receipt.py",
        "core/interop/dominium/**",
        "Dominium"
      ],
      "invocation_limit": 1,
      "registered_capability_id": "aide.self.validate"
    },
    "stop_state": "needs_review",
    "task_id": "AIDE-BUILD-AIDE-SELF-VALIDATION-PROCESS-ADAPTER-01",
    "title": "Build AIDE Self-Validation Process Adapter",
    "validation": {
      "commands": [
        {
          "command": "py -3 .aide/scripts/aide_lite.py aide-self-validation-process-adapter run",
          "exit_code": 0,
          "notes": "Invokes exactly one allowlisted AIDE Lite validate process.",
          "status": "PASS_WITH_WARNINGS"
        },
        {
          "command": "py -3 -m unittest discover -s .aide/scripts/tests -p test_aide_self_validation_process_adapter.py",
          "exit_code": 0,
          "notes": "Focused fake-runner adapter tests.",
          "status": "PASS"
        }
      ]
    },
    "work_type": "build"
  },
  "status": {
    "phase": "needs_review",
    "result": "PASS_WITH_WARNINGS",
    "validated": true,
    "validation_errors": [],
    "validation_warnings": [
      "The registered-process provider remains proposed and unaccepted pending Eureka reuse proof."
    ]
  }
}
